title,description
Design User Interface, Create wireframes and mockups for the new website homepage.
Develop Backend API, Build RESTful API endpoints for user authentication and data retrieval.
Write Unit Tests, Implement unit tests for the backend API to ensure code quality.
Conduct User Testing, Recruit participants and facilitate usability testing sessions.
Optimize Database Queries, Identify and optimize slow-running database queries.
Integrate Payment Gateway, Integrate a secure payment gateway for online purchases.
Implement Email Notifications, Set up email notifications for user registration and password resets.
Deploy to Production, Deploy the application to the production server.
Create Technical Documentation, Write detailed technical documentation for the project.
Train Support Team, Train the support team on how to troubleshoot common issues.
Improve Website Performance, Optimize website loading speed and reduce page load time.
Enhance Security Measures, Implement additional security measures to protect user data.
Add Accessibility Features, Make the website accessible to users with disabilities.
Implement Analytics Tracking, Set up Google Analytics to track website traffic and user behavior.
Create Marketing Materials, Design marketing materials to promote the website.
Optimize Search Engine Visibility, Improve the website's search engine ranking.
Develop Mobile App, Build a mobile app for iOS and Android.
Integrate Social Media, Integrate social media features like login and sharing.
Implement Real-time Chat, Add real-time chat functionality to the website.
Create User Onboarding Flow, Design a user-friendly onboarding process for new users.
Optimize Image Assets, Optimize images for web and mobile devices.
Implement A/B Testing, Set up A/B tests to experiment with different website designs.
Add Multilingual Support, Add support for multiple languages.
Integrate Voice Assistant, Integrate with voice assistants like Google Assistant and Alexa.
Implement Machine Learning Model, Train a machine learning model to personalize user experience.
Create Data Visualization Dashboard, Create a dashboard to visualize key metrics.
Develop Offline Functionality, Enable the mobile app to work offline.
Implement Continuous Integration/Continuous Delivery (CI/CD), Automate the build and test and deployment process.